{
  "question_id": "se-201",
  "topic": "SOLID-Prinzipien",
  "short_label": "SOLID nennen",
  "type": "definition",
  "question": "Wofür steht SOLID? (Nennen Sie die einzelnen Prinzipien)",
  "max_points": 5,
  "source_note": "Softwaretechnik-I-Klausur, Hochschule Merseburg, SS 2026; sieben anonymisierte Bögen, wortgetreu transkribiert (inkl. Rechtschreibfehlern, englischen Passagen und leeren Feldern). Aufgabe 1.",
  "rubric": [
    {
      "id": 1,
      "criterion": "Single Responsibility Principle genannt",
      "points": 1
    },
    {
      "id": 2,
      "criterion": "Open/Closed Principle genannt",
      "points": 1
    },
    {
      "id": 3,
      "criterion": "Liskov Substitution Principle genannt",
      "points": 1
    },
    {
      "id": 4,
      "criterion": "Interface Segregation Principle genannt",
      "points": 1
    },
    {
      "id": 5,
      "criterion": "Dependency Inversion Principle genannt",
      "points": 1
    }
  ],
  "answers": [
    {
      "answer_id": "se-201-bogen1",
      "points": 5,
      "level": "voll",
      "variant": "bogen-1",
      "operation": "base",
      "rubric_fulfilled": [
        1,
        2,
        3,
        4,
        5
      ],
      "text": "Solid besteht aus Fünf Entwurfsprinzipien für Objektorientieren Software Entwicklun\nS: Single Responsibility Principle\nO: Open/Closed Principle\nL: Liskov Substitution Principle\nI: Interface Segregation Principle\nD: Dependacy Inversio Principle"
    },
    {
      "answer_id": "se-201-bogen2",
      "points": 1,
      "level": "teil",
      "variant": "bogen-2",
      "operation": "base",
      "rubric_fulfilled": [
        2
      ],
      "text": "S:\nO: Open/Close Principle\nL: Lukow Inheritance Principle\nI:\nD:"
    },
    {
      "answer_id": "se-201-bogen3",
      "points": 4,
      "level": "teil",
      "variant": "bogen-3",
      "operation": "base",
      "rubric_fulfilled": [
        1,
        2,
        3,
        5
      ],
      "text": "ist fünf Regeln besteht in Feinentwurf, um flexiber und ertweterbar und wartbar software zu entwickeln\nS: Singel Ricpinciblty\nO: Open/Close\nL: Liskovsubtitution\nI: Inteface agregartion\nD: Depancy Inversione"
    },
    {
      "answer_id": "se-201-bogen4",
      "points": 4,
      "level": "teil",
      "variant": "bogen-4",
      "operation": "base",
      "rubric_fulfilled": [
        1,
        2,
        3,
        4
      ],
      "text": "S: Single Responsibility Principle\nO: Open Close Principle\nL: Liskove Substitution Principle\nI: Interface Segregation Principle\nD: Dependency Principle"
    },
    {
      "answer_id": "se-201-bogen5",
      "points": 5,
      "level": "voll",
      "variant": "bogen-5",
      "operation": "base",
      "rubric_fulfilled": [
        1,
        2,
        3,
        4,
        5
      ],
      "text": "S: Single Responsibility Principle\nO: Open/Closed Principle\nL: Liskov Substitution Principle\nI: Interface Segregation Principle\nD: Dependacy Inversion Principle"
    },
    {
      "answer_id": "se-201-bogen6",
      "points": 0,
      "level": "null",
      "variant": "bogen-6",
      "operation": "base",
      "rubric_fulfilled": [],
      "text": "Solid Prinzipien sind wichtig, um Code sauber und ohne fehler, mit bessere-qualität zu schreiben (implementieren).\nDie Prinzipien beschreiben ein wichtige Eigenschaften, ein Code haben muss.\nJeder der Prinzipien beschreibt ein bestimmte Aspekt, die man dafür achten müssen.\nEs ist auch sehr hilfreich bei Teamarbeit, mit Solid kann man Implimentierung Prispektiven Standardisieren."
    },
    {
      "answer_id": "se-201-bogen7",
      "points": 5,
      "level": "voll",
      "variant": "bogen-7",
      "operation": "base",
      "rubric_fulfilled": [
        1,
        2,
        3,
        4,
        5
      ],
      "text": "Solid Prinzipien dienen dazu, wartbare und erweiterbare Software Systeme zu entwickeln. Die einzelnen Prinzipien sind:\nS: Single Responsibility Principle (SRP)\nO: Open/Closed Principle (OCP)\nL: Liskov Substitution Principle (LSP)\nI: Interface Segregation Principle (ISP)\nD: Dependancy Inversion Principle (OIP)"
    }
  ]
}
